id,projectName,description,date,fundsLost,fundsReturned,chaindIds,category,issueType,token
3264,Silk Road,"<p><strong>Quick Summary</strong></p><p>Silk Road dark web market was exploited on 19 September 2012. 50,676 $BTC was seized from James Zhong by the U.S. Government after pleading a fraud.</p><p><br></p><p><strong>Details of the Exploit</strong></p><p>Silk Road was an anonymous market running on the darknet since 2011 until the FBI shut down the website in 2013 and arrested Ross Ulbricht. The website was exploited by James Zhong for approximately 53,500 $BTC. Then the funds were distributed between multiple addresses and part of them were swapped to $BCH.&nbsp;</p><p><br></p><p><strong>Block Data Reference</strong></p><p>Attacker addresses:</p><p>https://www.blockchain.com/btc/address/1DwCny29uDhpmd8Mz4hKudwmrSGBdUvrtL</p><p>https://www.blockchain.com/btc/address/12hkgmdqps76Bp3e466c2DTGDfg8tKRGLM</p><p>https://www.blockchain.com/btc/address/1P1ik9HkCNSs7Zmgc3LzEN72X1Egwm9Chb</p>",2012-09-19,3360000000,3360000000,[],Other,Other,{'name': None}
2808,Mt. Gox (3),"<p><strong>Quick Summary</strong></p><p>One of the world's largest exchanges, Mt. Gox, declared bankruptcy in 2014 after being hacked, while losing most of its assets. At the time of bankruptcy, the exchange held 200k $BTC.</p><p><br></p><p><strong>Details of the Exploit</strong></p><p>Mt. Gox was a bitcoin exchange based in Shibuya, Tokyo, Japan. Launched in 2010, it processed more than 70% of all Bitcoin (BTC) transactions worldwide by the beginning of 2014.</p><p>At the beginning of 2014, Mt Gox, a bitcoin exchange based in Japan, was the largest bitcoin exchange in the world, handling over 70% of all bitcoin transactions worldwide. By the end of February of that year, it was bankrupt.<br>Anyone who was using Mt. Gox lost access to their assets, and it has been a cautionary tale for crypto investors. While the assets weren’t all lost, anything that was left has been frozen for years.<br>The victim of a massive hack, Mt. Gox lost about 740,000 bitcoins (6% of all bitcoin in existence at the time), valued at the equivalent of €473 million at the time and over $3 billion at October 2017 prices. An additional $27 million was missing from the company’s bank accounts.</p><p><br></p><p><strong>Block Data Reference</strong></p><p>Attacker address:</p><p>https://www.blockchain.com/btc/address/1FeexV6bAHb8ybZjqQMjJrcCrHGW9sb6uF</p>",2014-02-24,473000000,0,[],CeFi,Other,{'name': None}
2939,MyCoin,"<p><strong>Quick Summary</strong></p><p>Hong Kong bitcoin exchange MyCoin was shot down, taking with it as much as HK$3bn ($386.9m) in investor funds.&nbsp;</p><p><strong><br>Details of the Exploit</strong></p><p>MyCoin promised its investors a return of 150% for a few months of locking up 90 Bitcoin at a price of HK$400,000 at the time.</p><p><br></p><p>30 people were claiming to be victims of the company's actions petitioned a local member of the Legislative Council, Leung Yiu-Chung.<br><br>Some reports stated the company never operated as a genuine bitcoin business at all. Testimonies from customers describe an operation more like a Ponzi scheme that used the veneer of bitcoin trading as its lure.<br><br>Customers were never presented with receipts and were led to deposit their newly-acquired coins at a separate site to earn interest.<br><br>MyCoin had promised that it would soon be listed on the Hong Kong stock exchange, and according to photos posted online, also operated a bitcoin ATM:<br>http://news.yibite.com/application/2015/0208/27667.shtml</p>",2015-02-09,387000000,0,[],CeFi,Rugpull,{'name': None}
3260,Trade Coin Club,"<p><strong>Quick Summary</strong></p><p>Trade Coin Club founders were running a Ponzi Scheme by conning investors for a fraudulent crypto trading bot. Roughly 295,000,000 $USD worth of $BTC was scammed.</p><p><br></p><p><strong>Details of the Exploit</strong></p><p>Trade Coin Club is an investment company, which promises ""minimum returns of 0,35% daily"" by ""performing millions of microtransactions per second"". The company ran a Ponzi Scheme and actually had no trading bot. The funds from 100,000 worldwide investor's deposits were withdrawn directly by the four people to enrich themselves.&nbsp;</p>",2016-08-02,295000000,0,[],CeFi,Other,{'name': None}
2926,BTC-e,"<p><strong>Quick Summary</strong></p><p>The popular Russian bitcoin exchange BTC-e suddenly stopped working. On Twitter, it was written that the exchange is under ""server maintenance"".</p><p><br></p><p><strong>Details of the Exploit</strong></p><p>BTC-E is now a closed online trading platform for fiat currencies and cryptocurrencies in real time, focused primarily on Russian—speaking users.</p><p>Compliance-as-a-service company Coinfirm discussed the BTC-e situation and the 66,000 Bitcoins moved.<br>According to Pawel Kuskowski, CEO &amp; Co-Founder at Coinfirm, right after the arrest of Alexander Vinnik, broadly referred to as the mastermind behind BTC-e, over 66,000 BTC were moved from 18f1yugoAJuXcHAbsuRVLQC9TezJ6iVRLp across the Bitcoin ecosystem.<br>Founded in 2011, BTC-e was one of the world's largest and most widely used digital currency exchanges. Cybercriminals around the world used it to launder and liquidate illegally obtained digital currencies, according to the U.S. indictment.<br>The exchange had no anti-money laundering controls or policies and was found to have received criminal proceeds of ransomware attacks, identity theft schemes, computer breaches and other hacking incidents, as well as corrupt public officials and narcotics distribution rings, according to the indictment. Between 2011 and December 2016, bitcoin addresses and digital wallets associated with BTC-e received over 9.4 million bitcoins, according to the federal indictment.</p>",2017-07-26,181000000,0,[],CeFi,Rugpull,{'name': None}
2924,Control Finance,"<p><strong>Quick Summary</strong></p><p>A massive Ponzi scheme was revealed on the Bitcoin chain. Control Finance was fraudulently promoted as a cryptocurrency investment company.</p><p><br></p><p><strong>Details of the Exploit</strong></p><p>The regulator filed an enforcement action complaint against the United Kingdom-based company and its director for “fraudulently obtaining and misappropriating” at least 22,858.822 &nbsp;Bitcoin, then worth $147 million. Per the complaint, the scam has victimized over 1,000 customers.<br><br>The allegedly fraudulent entity claimed that the investors would receive daily trading profits of 1.5 percent and up to 45 percent in monthly profits. It also claimed to have used risk diversification methods to protect customers’ Bitcoin deposits.<br><br>However, the US regulator found out that the company did not make a single trade with the collected funds. To deceive the victims, it projected fake balances on their accounts and also published reports with false data.</p>",2017-09-10,147000000,0,[],CeFi,Rugpull,{'name': None}
2921,Parity,"<p><strong>Quick Summary</strong></p><p>513,000 $ETH has been locked and maintained unreachable on Parity contracts after the user accidentally killed it.</p><p><br></p><p><strong>Details of the Exploit</strong></p><p>On November 6th, 2017, Github user devops199 posted the following statement under the Github issues section of the Parity Multi-Sig Library: “I accidentally killed it”:<br>https://github.com/openethereum/parity-ethereum/issues/6995<br><br>Just moments earlier, devops199 exploited a vulnerability within the smart-contract library code, blocking funds in 587 wallets holding a total of 513,774.16 Ether as well as various other tokens.<br><br>On November 6th, the transaction was sent to WalletLibrary, which called the <u>initWallet</u> method:<br>https://etherscan.io/tx/0x05f71e1b2cb4f03e547739db15d080fd30c989eda04d37ce6264c5686e0722c9<br><br>This transaction ended up making the 0xae7168deb525862f4fee37d987a971b385b96952 the sole owner. The transaction, which called the <u>kill</u> method of <u>WalletLibrary</u> with 0xae7168deb525862f4fee37d987a971b385b96952 as the beneficiary address:<br>https://etherscan.io/tx/0x47f7cff7a5e671884629c93b368cb18f58a993f4b19c2a53a8662e3f1482f690<br><br>Approximately 30 minutes later, Devops199 created Parity issue #6995 to document what had just occurred:<br>https://github.com/openethereum/parity-ethereum/issues/6995<br><br>Devops199 posted a link to the issue in the Parity gitter channel, asking “Is this serious issue?” He then followed up by asking “Will I get arrested for this?”. It seemed as though Devops199 failed to understand the consequences of what he had done, by stating “I’m eth newbie..just learning”.</p><p><br>About three hours later, Parity released a warning on Twitter:<br>https://twitter.com/ParityTech/status/927850992145719296</p>",2017-11-08,155000000,0,[1],Other,Other,{'name': None}
2735,BitConnect,"<p><strong>Quick Summary</strong></p><p>BitConnect was a Ponzi Scheme that managed to raise approx. $2 billion dollars from investors before it collapsed.</p><p><strong><br>Details of the Exploit</strong></p><p>BitConnect is a crypto lending platform, which claimed it used a trading bot for earning interest.<br><br>In fact, BitConnect was suspected of being a Ponzi scheme because of its multilevel marketing structure and impossibly high payouts (1% daily compounded interest). BitConnect interest fluctuated greatly with the volatility of Bitcoin, which its value was tied to.<br><br>The BitConnect Coin was among the world's top 20 most successful cryptocurrency tokens until its price collapsed after traders began losing confidence. BCC rose from a post ICO price of $0.17 to an all-time high of US$463 in December 2017; it declined to US$0.40 as of March 11, 2019. BitConnect released outstanding loans at a rate of US$363.62 to the BitConnect Wallet in form of BCC. However, soon after that news the internal exchange price and liquidity collapsed resulting in a nearly complete loss of value. Prosecutors managed to seize crypto assets worth $57 million from Arcaro, BitConnect's biggest partner in North America.</p>",2018-01-15,2000000000,56000000,[],"Borrowing and Lending,CeFi",Rugpull,{'name': 'BCC'}
2643,Coincheck,"<p><strong>Quick Summary</strong></p><p>On Jan. 26, about 523 million NEM (XEM) tokens, valued at over $530 million at the time, were illicitly transferred from its hot wallet address, resulting in an anomalous drop in the Japanese exchange's balance.</p><p><strong><br>Details of the Exploit</strong><br>The attack was made possible by the company's technological issues and staff scarcity, which resulted in inadequate security measures. The stolen NEM were held on an internet-connected hot wallet rather than an offline cold wallet.<br><br>Coincheck utilized its own funds to compensate all 260,000 impacted clients:<br>https://www.ft.com/content/6a761a60-2694-11e8-b27e-cc62a39d57a0</p><p><br></p><p><strong>Block Data Reference</strong></p><p>Attacker address:</p><p>https://explorer.nemtool.com/#/s_account?account=NC4C6PSUW5CLTDT5SXAGJDQJGZNESKFK5MCN77OG</p><p><br></p><p>Malicious transaction example:</p><p>https://explorer.nemtool.com/#/s_tx?hash=c2921d538a6192bf35e0bb49cefcf6aa8e19acb3fef08f70f5b6b977d9d50aee</p>",2018-01-26,534000000,534000000,[],CeFi,Other,{'name': None}
2652,BitGrail,"<p><strong>Quick Summary</strong></p><p>The BitGrail Operator may have hacked own crypto exchange to steal 120,000,000 $USD</p><p><br></p><p><strong>Details of the Exploit</strong></p><p>The exchange was attacked by hackers in January-February 2018, as a result, 17 million Nano (NANO) tokens were stolen, worth between $146 million. Italian police have alleged a 34-year-old man from Florence, known as FF, is thought to be behind the theft from the exchange, which saw the company collapse into bankruptcy with significant losses for its users.<br><br>230,000 account holders at BitGrail were affected in the attack, which honed in on the platform’s reserves of Nano cryptocurrency. FF is thought to have been responsible, or to have taken no action to prevent the attack and the losses which resulted from it.</p>",2018-02-10,146000000,0,[],CeFi,Other,{'name': None}
3267,Gate.io (2),"<p><strong>Quick Summary</strong></p><p>Gate.io crypto exchange's cold wallets were exploited via access control. The previous hacker address on the 2015 exploit was involved in this one too. The stolen amount reached roughly 230,000,000 $USD.</p><p><br></p><p><strong>Details of the Exploit</strong></p><p>Gate.io is a centralized crypto exchange. The exchange's cold wallet's private keys were compromised. There is an address involved in the previous 14 February 2015 hack. The total stolen funds were valued at 234,337,668 $USD at the moment of the accident, which contains 10,777 $BTC, 218,790 $ETH, 175,866 $ETC, 3,043,268 $XRP, 11,000 $LTC, 3,783 $ZEC, and 99,999,000 $DOGE.&nbsp;</p><p><br></p><p><strong>Block Data Reference</strong></p><p>Compromised address:</p><p>https://www.blockchain.com/btc/address/1M2bv6sypZSp6uAEC9U4Gzvgp6jd29F87e</p><p><br></p><p>Major transactions:</p><p>https://www.blockchain.com/btc/tx/086f9d27f574c7a1b9179fc7524c2a5227a095ca7c3b096d93ed6fbf8e92af16</p><p>https://www.blockchain.com/btc/tx/d08acac36311373f81f45179de3aa72174cb665122eb2aadefc74738fc6cbcd5</p>",2018-04-21,230000000,0,[],CeFi,Access Control,{'name': 'GT'}
2903,QuadrigaCX,"<p><strong>Quick Summary</strong></p><p>QuadrigaCS owes its customers approximately 190,000,000 $USD.</p><p><br></p><p><strong>Details of the Exploit</strong></p><p>According to a court petition, the troubled Canadian crypto exchange QuadrigaCX owes its clients $190 million and is unable to access the majority of the assets.<br><br>Jennifer Robertson, the widow of QuadrigaCX founder Gerald Cotten, stated in a signed document filed Jan. 31 with the Nova Scotia Supreme Court that the exchange owes its clients around $250 million CAD ($190 million) in both bitcoin and cash. The firm previously declared on its website that it had filed for creditor protection, but the document itself reveals further information about its plight.<br><br>According to the petition, there were around 115,000 individuals with balances signed up on the exchange as of January 31, 2019, with $70 million CAD in fiat and $180 million CAD in crypto owing altogether.<br><br>Cotten reportedly died of Crohn’s disease in Jaipur, India in early December 2018. The exchange announced his death earlier this month. A death certificate was included in the list of exhibits. The founder seemingly had sole control or knowledge of Quadriga’s cold storage solution. Robertson wrote that after his death, “Quadriga’s inventory of cryptocurrency has become unavailable and some of it may be lost.”</p>",2019-02-04,147000000,0,[],CeFi,Access Control,{'name': None}
2890,Token.Store,"<p><strong>Quick Summary</strong></p><p>The team working on the Token.Store wallet decided to close and leave with the users' funds, taking $160 million.<strong><br></strong></p><p><strong><br></strong></p><p><strong>Details of the Exploit</strong></p><p>Token.Store is a decentralized cryptocurrency exchange launched in July 2017.</p><p>Token.Store meant itself as a centralized exchanger like Binance, FX, with a good development team, user data protection and conscientious owners. In practice, it turned out to be a scam project that at some point ""ran away"" from its users, investors, while taking a billion $CNY including $BTC, $XRP, $ETH and other currencies.</p>",2019-06-11,160000000,0,[],CeFi,Rugpull,{'name': None}
2878,PlusToken,"<p><strong>Quick Summary</strong></p><p>The perpetrators of one of the largest digital currency frauds have been sentenced to up to 11 years in prison. In addition, the PlusToken operators were penalized up to $900,000 by a Chinese court for their participation in the $2.25 billion Ponzi scam.<br><strong><br>Details of the Exploit</strong><br>Chen Bo established PlusToken in early 2018, posing as a South Korean wallet and exchange. It enticed investors by promising speedy and guaranteed returns. In the two years afterwards, Bo has recruited numerous others and spread the fraud to other Southeast Asian nations such as China, Cambodia, Malaysia, Vanuatu, and Vietnam.<br><br>PlusToken operators had devised a pyramid scheme that managed to lure over 2.6 million investors, authorities said. The scam was organized into at least 3,200 investor levels, with more referrals and bigger investments bumping an investor up the chain. The operators also lied to investors that they were making money through digital currency investing, according to investors.</p>",2019-12-16,2900000000,0,[],CeFi,Rugpull,{'name': None}
2871,WoToken,"<p><strong>Quick Summary</strong></p><p>WoToken scam took in roughly $1 billion worth of crypto at current prices from over 715,000 victims.</p><p style='box-sizing: inherit; margin: 8px 0px 0px; padding: 0px; border: 0px; outline: none; -webkit-tap-highlight-color: rgba(0, 0, 0, 0); transition: background 0.45s ease-in 0s, background-color 0.45s ease-in 0s, border 0.45s ease-in 0s; line-height: 1.4285em; font-family: ""Avenir Next"", sans-serif; overflow-wrap: break-word; color: rgb(5, 15, 25); font-size: 14px; font-style: normal; font-variant-ligatures: normal; font-variant-caps: normal; font-weight: 500; letter-spacing: normal; orphans: 2; text-align: start; text-indent: 0px; text-transform: none; white-space: normal; widows: 2; word-spacing: 0px; -webkit-text-stroke-width: 0px; background-color: rgb(250, 251, 252); text-decoration-thickness: initial; text-decoration-style: initial; text-decoration-color: initial;'><strong style='box-sizing: inherit; margin: 0px; padding: 0px; border: 0px; outline: none; -webkit-tap-highlight-color: rgba(0, 0, 0, 0); transition: background 0.45s ease-in 0s, background-color 0.45s ease-in 0s, border 0.45s ease-in 0s; font-weight: 700; font-family: ""Avenir Next"", sans-serif !important;'><br style=""box-sizing: inherit; margin: 0px; padding: 0px; border: 0px; outline: none; -webkit-tap-highlight-color: rgba(0, 0, 0, 0); transition: background 0.45s ease-in 0s, background-color 0.45s ease-in 0s, border 0.45s ease-in 0s; font-family: &quot;Avenir Next&quot;, sans-serif !important;""></strong><strong>Details of the Exploit</strong></p><p style='box-sizing: inherit; margin: 8px 0px 0px; padding: 0px; border: 0px; outline: none; -webkit-tap-highlight-color: rgba(0, 0, 0, 0); transition: background 0.45s ease-in 0s, background-color 0.45s ease-in 0s, border 0.45s ease-in 0s; line-height: 1.4285em; font-family: ""Avenir Next"", sans-serif; overflow-wrap: break-word; color: rgb(5, 15, 25); font-size: 14px; font-style: normal; font-variant-ligatures: normal; font-variant-caps: normal; font-weight: 500; letter-spacing: normal; orphans: 2; text-align: start; text-indent: 0px; text-transform: none; white-space: normal; widows: 2; word-spacing: 0px; -webkit-text-stroke-width: 0px; background-color: rgb(250, 251, 252); text-decoration-thickness: initial; text-decoration-style: initial; text-decoration-color: initial;'><span style='color: rgb(5, 15, 25); font-family: ""Avenir Next"", sans-serif; font-size: 14px; font-style: normal; font-variant-ligatures: normal; font-variant-caps: normal; font-weight: 500; letter-spacing: normal; orphans: 2; text-align: start; text-indent: 0px; text-transform: none; white-space: normal; widows: 2; word-spacing: 0px; -webkit-text-stroke-width: 0px; background-color: rgb(250, 251, 252); text-decoration-thickness: initial; text-decoration-style: initial; text-decoration-color: initial; display: inline !important; float: none;'>WoToken purported to create profits for users by deploying algorithmic trading bots and paying affiliates referral commissions. The stated proprietary trading program, however, did not exist, as with other MLM frauds.</span></p><p style='box-sizing: inherit; margin: 8px 0px 0px; padding: 0px; border: 0px; outline: none; -webkit-tap-highlight-color: rgba(0, 0, 0, 0); transition: background 0.45s ease-in 0s, background-color 0.45s ease-in 0s, border 0.45s ease-in 0s; line-height: 1.4285em; font-family: ""Avenir Next"", sans-serif; overflow-wrap: break-word; color: rgb(5, 15, 25); font-size: 14px; font-style: normal; font-variant-ligatures: normal; font-variant-caps: normal; font-weight: 500; letter-spacing: normal; orphans: 2; text-align: start; text-indent: 0px; text-transform: none; white-space: normal; widows: 2; word-spacing: 0px; -webkit-text-stroke-width: 0px; background-color: rgb(250, 251, 252); text-decoration-thickness: initial; text-decoration-style: initial; text-decoration-color: initial;'>One of the scam's key operators is allegedly tied to PlusToken, a multibillion-dollar Ponzi scheme that is thought to have influenced the price trajectory of Bitcoin (BTC) many times during 2019.<br><br>WoToken amassed 46,000 BTC, over 2 million Ethereum (ETH), 292,000 Litecoin (LTC), 56,000 Bitcoin Cash (BCH), and 684,00 Eos (EOS) – totaling approximately $1 billion at the time of the arrest.<br><br>WoToken was operational from July 2018 until October 2019.</p>",2020-05-14,1000000000,0,[],CeFi,Rugpull,{'name': None}
2644,KuCoin,"<p><strong>Quick Summary&nbsp;</strong></p><p>Hackers managed to obtain the private keys to KuCoin's hot wallets and drain the exchange for various crypto assets in the amount of $280 million.&nbsp;</p><p><br></p><p><strong>Details of the Exploit</strong></p><p>This case lacks information with regard to the methodology hackers utilized in order to gain access to KuCoin's hot wallets. The hot wallet affected were designated for Bitcoin, Ethereum, and ERC-20 tokens.<br><br>Stolen funds included:<br>- 1,008 BTC ($10,758,404.86)<br>- 11,543 ETH ($4,030,957.90)<br>- 19,834,042 USDT-ETH ($19,834,042.14)<br>- 18,495,798 XRP ($4,254,547.54)<br>- 26,733 LTC ($1,238,539.89)<br>- 999,160 USDT ($999,160)<br>- $147M worth of ERC-20 tokens<br>- $87M of Stellar tokens<br><br>In an attempt to launder the ill-gotten funds, the attackers proceeded to use a mixture of DeFi protocols such as Kyber and Uniswap.<br>The CEO of KuCoin claims that through a mixture of on-chain analyses, judicial recovery, as well as contract upgrades, 84% of the stolen funds, had been recovered. The remaining losses were covered by KuCoin's own capital and insurance fund.</p>",2020-09-25,280000000,280000000,[],CeFi,Access Control,{'name': None}
2363,Compound Labs,"<p><strong>Quick Summary</strong></p><p>Two big liquidations occurred on Compound Protocol due to the $DAI price spike.&nbsp;</p><p><br></p><p><strong>Details of the Exploit</strong></p><p>Compound is the lending protocol that also provides yield functionality. Around $89 million was liquidated on the protocol Compound due to the oracle issue, as far as Compound's oracle uses Coinbase for pricing data. The price of $DAI token spiked up to $1.3 on the Coinbase Pro exchange. Since many of the loans were undercollateralized, they were liquidated.</p><p><br></p><p><strong>Block Data Reference</strong><br>$46 million liquidation transaction:<br>https://etherscan.io/tx/0x53e09adb77d1e3ea593c933a85bd4472371e03da12e3fec853b5bc7fac50f3e4<br>Address liquidated on $17.5 million in several transactions:<br>https://etherscan.io/address/0xb1adceddb2941033a090dd166a462fe1c2029484</p><p><br></p>",2020-11-26,89000000,0,[1],Borrowing and Lending,Oracle Issue,{'name': 'COMP'}
2861,Thodex,"<p><strong>Quick Summary</strong></p><p>Thodex a turkish crypto exchange went down with other $2 billion of user funds entangled in massive fraud and mismanagement.<strong><br></strong></p><p><br></p><p><strong>Details of the Exploit</strong></p><p>According to a translated statement on the website, Thodex, a crypto exchange that is located in Turkey, stated its platform has been ""temporarily stopped"" to handle an ""abnormal fluctuation in the company accounts.""<br><br>According to local media, Thodex's founder, Faruk Fatih Özer, has gone to Albania with $2 billion of investors' funds. The Demiroren News Agency published a photo of Ozer departing Istanbul Airport:<br>https://www.dha.com.tr/gundem/thodexin-kurucusu-faruk-fatih-ozerin-havalimanindan-ayrilirken-fotografi-1822744</p><p>The CEO has since declared that he has been close to committing suicide but decided against it. According to his own words, Faruk Fatih Özer, plans to repay all investors before handing himself in to authorities.</p>",2021-04-22,2000000000,0,[],CeFi,Rugpull,{'name': None}
2591,Venus,"<p><strong>Quick Summary</strong></p><p>The Venus Protocol experienced a massive liquidation event, due to market circumstances and oracle problems</p><p><br></p><p><strong>Details of the Exploit</strong></p><p>Venus Protocol is an algorithmic-based money market system, that offers lending opportunities on Binance Smart Chain. The project experienced a big liquidation event. In comparison, the 0xef044206db68e40520 bfa82d45419d498b4bc7bf account lost about $66 million in net loss. Liquidators earned around $20 million profit; Sellers made approximately $55 million profit, and Scalpers made approximately $2 million profit.<br><br>Due to unpredictable market fluctuations and the lack of deviation controls on oracles, the protocol lost about $77 million.</p><p><br></p><p><strong>Block Data Reference</strong></p><p>Token address:</p><p>https://bscscan.com/address/0xcf6bb5389c92bdda8a3747ddb454cb7a64626c63</p><p><br></p>",2021-05-18,77000000,0,[2],Borrowing and Lending,Oracle Issue,{'name': 'XVS'}
