id,projectName,description,date,fundsLost,fundsReturned,chaindIds,category,issueType,token
2368,Meerkat Finance,"<p><strong>Quick Summary</strong></p><p>Meerkat Finance was allegedly rug pulled by its team or an external attacker for the amount of $32 million through proxy upgradable smart contracts.</p><p><br></p><p><strong>Details of the Exploit</strong></p><p>Meerkat Finance was a fork of the successful Alpaca Finance project. Essentially, Meerkat Finance was a lending and yield aggregation protocol offering its users yield through lending assets or pledging assets to the platforms vaults. The vaults would pursuit automated investment strategies.</p><p>This rekt case gained traction when the contract deployer invoked the <u>upgradeTo</u>() function, setting new implementation to the BUSD Vault at:<br>https://bscscan.com/tx/0xf19fa4bcff4adaebeddd28c851458ba0f01ffedd52b62df56ace94e7c8842553<br>The contract deployer also invoked the <u>upgradeTo</u>() function, setting new implementation to WBNB Vault at:<br>https://bscscan.com/tx/0x063970f8625f250101a7da8abf914748cf8eaaaa9458041f1928501accfe5<br><br>This altered the vault logic, introducing two new functions that were not included in the earlier implementations. This is where the real danger of proxy upgradable smart contracts lies. Code is king in DeFi and rather than trusting mediators users of DeFi can trust the code. However, when the code becomes changeable and upgradable by a centralized entity without governance by the token holder, the story changes.<br><br>An external address, marked as Fake_Phishing 17, invoked <u>init</u>() function to the Vaults through the proxy contract at:<br>https://bscscan.com/tx/0xfcf48681e382e9f9cc1d6a64ff30487306f6b869924c6594075fcc86b3b21f5d<br>https://bscscan.com/tx/0x5050d0f2f2d4d8ea76b04f25b1ee04b04d2b7beb6dafc6921672eaa448345027<br><br>According to decompiled bytecode, this function sets the address on storage slot 0 to the address provided to the function. There’s no permission check, making this newly added function the backdoor into the vaults.<br><br>The attacker called method <u>0x70fcb0a7</u> on BUSD Vault to transfer out 13,968,039 BUSD at:<br>https://bscscan.com/tx/0x1332fadcc5378b1cc90159e603b99e0b73ad992b1e6389e012af3872c8cae27d<br><br>The attacker called method <u>0x70fcb0a7</u> on WBNB Vault to transfer out 73,635 WBNB at:<br>https://bscscan.com/tx/0xd8145dfe255a671428b9c082a006a145fe58d82175671e8bfbe02f4040ae8cd0</p><p data-v-51e0c2ec=""""><br></p><p style=""margin:0cm;background:white;""><strong>Block Data Reference</strong></p><p style=""margin:0cm;background:white;"">BUSD Vault:</p><p style=""margin:0cm;background:white;"">https://bscscan.com/address/0x7e0c621ea9f7afd5b86a50b0942eaee68b04a61c</p><p style=""margin:0cm;background:white;"">BNB Vault:</p><p style=""margin:0cm;background:white;"">https://bscscan.com/address/0x639f18c72b6a017bdd209c161d1617c9481a1e4d</p><p style=""margin:0cm;background:white;"">External Hacker Address (Fake_Phishing 17):</p><p style=""margin:0cm;background:white;"">https://bscscan.com/address/0x9542966f1114eaa5859201aa8d34358bfedbfa79</p>",2021-03-04,30883780,0,[2],Yield Aggregator,Rugpull,{'name': 'MKAT'}
125,Paid Network (old),<p>The contract deployer transferred the ownership to the external address through the ProxyAdmin contract calling the <u>newOwner</u>() function at:<br>https://etherscan.io/tx/0x733dd279b3d24f3415f3850b8eceafc651c1998163dcd0352b9e83c46e2b33d9<br><br>The external wallet invoked <u>mint</u>() function to generate new tokens onto his wallet at:<br>https://etherscan.io/tx/0x4bb10927ea7afc2336033574b74ebd6f73ef35ac0db1bb96229627c9d77555a0<br><br>The external wallet started to sell tokens in the following transactions:<br>https://etherscan.io/address/0x18738290af1aaf96f0acfa945c9c31ab21cd65be#tokentxns<br><br>Stolen funds were deposited to the Tornado Cash mixer:<br>https://bloxy.info/txs/calls_from/0x18738290af1aaf96f0acfa945c9c31ab21cd65be?signature_id=994162&amp;smart_contract_address_bin=0x722122df12d4e14e13ac3b6895a86e84145b6967</p>,2021-03-05,27418034,0,[1],Other,Other,{'name': 'PAID'}
2365,EasyFi,"<p><strong>Quick Summary</strong></p><p>EasyFi project's admin keys and mnemonics were stolen during the sophisticated remote attack. The hacker used keys to stole user's deposits in several protocol pools.</p><p><br><strong>Details of the Exploit</strong><br>The admin keys of the contract deployer were compromised by the attacker remotely. The attacker withdrew the user's deposits from the protocol pools, namely from the USDT/USDC/Matic/ETH/DAI markets. In addition, around 2.98 Million EASY were stolen from the protocol's contracts.<br>EasyFi smart contracts were not exploited. The hacker used renBTC and WBTC to move the funds via the dark pool to hide the traces.</p><p><br></p><p><strong>Block Data Reference</strong></p><p>The attacker's address:<br>https://etherscan.io/address/0x83a2EB63B6Cc296529468Afa85DbDe4A469d8B37</p><p>Transaction:</p><p><span style='color: rgb(65, 65, 65); font-family: ""Open Sans"", sans-serif; font-size: 14px; font-style: normal; font-variant-ligatures: normal; font-variant-caps: normal; font-weight: 400; letter-spacing: normal; orphans: 2; text-align: left; text-indent: 0px; text-transform: none; white-space: normal; widows: 2; word-spacing: 0px; -webkit-text-stroke-width: 0px; background-color: rgb(255, 255, 255); text-decoration-thickness: initial; text-decoration-style: initial; text-decoration-color: initial; display: inline !important; float: none;'>https://bloxy.info/txs/transfers_to/0x83a2eb63b6cc296529468afa85dbde4a469d8b37?currency_id=548460</span></p>",2021-04-19,59000000,0,[1],Borrowing and Lending,Access Control,{'name': 'EASY'}
2367,Uranium Finance (2),"<p><strong>Quick Summary</strong><br>Pair contracts in Uranium v2 had a bug due to which anyone could interact with them and withdraw almost all tokens due to a calculation error.</p><p><br></p><p><strong>Details of the Exploit</strong><br>Before interacting with Uranium, the attacker sent the minimum amount of each token to pair contracts. After that, they used a low-level function <u>swap</u>() whose execution should drain both reserves.<br><br>Stolen funds:<br>- 34k WBNB ($18M)</p><p>- 17.9M BUSD ($17.9M)</p><p>- 1.8k ETH ($4.7M)</p><p>- 80 BTC ($4.3M)</p><p>- 26.5k DOT ($0.8M)</p><p>- 638k ADA ($0.8M)</p><p>- 5.7M USDT ($5.7M)</p><p>- 112k U92<br><br>With the help of PancakeSwap, DOT and ADA were swapped to ETH. After that, the attacker withdrew 2,438 ETH via Anyswap to Ethereum (deposited into Tornado Cash mixer at https://etherscan.io/txs?a=0xc61429117038a1f13881dd7410b80771f28e06ec) and 80 BTC to Bitcoin. 1M USDT and 99k DAI (bought with USDT) went to xDAI.</p><p><br></p><p><strong>Block Data Reference</strong></p><p>The attacker's address:<br>https://bscscan.com/address/0x2b528a28451e9853f51616f3b0f6d82af8bea6ae#tokentxns<br>The transaction behind the attack:<br>https://bscscan.com/tx/0x5a504fe72ef7fc76dfeb4d979e533af4e23fe37e90b5516186d5787893c37991</p>",2021-04-28,57200000,0,[2],Yield Aggregator,Other,"{'name': 'sRADS, U92, RADS'}"
2351,Spartan Protocol,"<p>The attacker's address:<br>https://bscscan.com/address/0x3b6e77722e2bbe97c1cfa337b42c0939aeb83671<br><br>The transaction of the attack:<br>https://bscscan.com/tx/0xb64ae25b0d836c25d115a9368319902c972a0215bd108ae17b1b9617dfb93af8<br><br>- A flash loan was taken for 10K WBNB, to be returned at the last step with 260 WBNB as the flash loan fee<br><br>- swapped WBNB to SPARTA five times through the exploited Spartan pool, with each time swapping in 1,913.172376149853767216 WBNB to get 621,865.037751148871481851 SPARTA<br><br>- the resulting total of 2,536,613.206101067206978364 SPARTA, plus 11,853.332738790033677468 WBNB, are then added into the pool, minting 933,350.959891510782264802 pool token (SPT1-WBNB)<br><br>- swapped WBNB to SPARTA ten times through the same pool, with each time swapping in 1,674.025829131122046314 WBNB to get 336,553.226646584413691711 SPARTA<br><br>- inflated the asset balance in the pool by transferring into the pool 21,632.147355962694186481 WBNB and all SPARTA from the above step 3, i.e., 2,639,121.977427448690750716 SPARTA<br><br>- burned the 933,350.959891510782264802 pool tokens obtained from step 2 to withdraw the liquidity. Since the pool’s asset balance is inflated, the burn operation leads to 2,538,199.153113548855179986 SPARTA and 20,694.059368262615067224 WBNB<br><br>- added the liquidity into the pool with the added assets in step 4 with 1,414,010.159908048805295494 pool tokens, which is immediately burned to obtain 2,643,882.074112804607308497 SPARTA and 21,555.69728926154636986 WBNB<br><br>- the above steps were repeated to continue draining funds from the pool<br><br>- returned the flash loan with 100,260 WBNB.<br><br>The attacker used 1inch (to swap all tokens to BTCB or BETH), Spartan (to dump SPARTA), Nerve (to swap BTCB and BETH to Anyswap versions). In this way, they were eventually able to withdraw part of the profit through Anyswap.</p>",2021-05-02,30500000,0,[2],Exchange (DEX),Flash Loan Attack,{'name': 'SPARTA'}
2369,xToken,"<p>The transaction behind the attack:<br>https://etherscan.io/tx/0x7cc7d935d895980cdd905b2a134597fb91004b5d551d6db0fb265e3d9840da22<br><br>The attacker's address:<br>https://etherscan.io/address/0x07e02088d68229300ae503395c6536f09179dc3e<br><br>The attacker:</p><p>- borrowed 61.8k ETH flash loan on dYdX<br><br>- deposited 10k ETH to borrow 564k SNX on Aave and swap 5.5k ETH to 700k SNX on SushiSwap<br><br>- sold 1.2M SNX for 818 ETH on Uniswap v2, significantly reducing the SNX price<br><br>- used only 0.12 ETH to mint 1.2B xSNXa, because the protocol buys SNX through Kyber, who in turn led to use Uniswap v2 for this swap<br><br>- however, within the protocol, the xSNXa price turned out to be normal, which made it possible to swap 105M xSNX into 414 ETH<br><br>- began to do reverse swaps in SushiSwap and Uniswap and repaid loans in Aave<br><br>- began to sell the existing xSNXa to the Balancer SNX/ETH/xSNXa (25/25/50) pool<br><br>- repaid the flash loan to dYdX<br><br>- issued xBNTa four times for 0.03 ETH, which ultimately gave them 3.9B xBNTa<br><br>- swapped half of xBNTa to 781k BNT.<br><br>Funds lost:<br><br>- 2.4k ETH ($10.3M)</p><p>- 781k BNT ($6.2M)</p><p>- 407k SNX ($8M)</p><p>- 1.9B xBNTa.</p>",2021-05-12,24000000,0,[1],Token,Flash Loan Attack,{'name': 'XTK'}
723,PancakeBunny,"<p>8 flash loans were used to manipulate the price on various PancakeSwap pools, creating a skewed calculation of the BUNNY price in the VaultFliptoFlip vault. The transaction, where flash loans were used:<br>https://bscscan.com/tx/0x897c2de73dd55d7701e1b69ffb3a17b0f4801ced88b0c75fe1551c5fcce6a979<br><br>The attacker:<br>- borrowed 1.05M WBNB from WBNB+CAKE pool, 522.52K WBNB from WBNB+BUSD pool, 210.16K WBNB from WBNB+ETH pool, 133.50K WBNB from WBNB+BTCB pool, 241.02K WBNB from WBNB+SAFEMOON pool, 98.519K WBNB from WBNB+BELT pool, 66.29K WBNB from WBNB+DOT pool, and 2.96M USDT from Fortube Bank. The first seven flash loans are taken from various PancakeSwap pools while the last comes from Fortube Bank<br><br>- deposited 2.96M USDT and 7886 WBNB into WBNB+BUSDT pool as liquidity and minted 144.45K LP tokens<br><br>- swapped 2.32M WBNB for 3.83M BUSDT via the WBNB+BUSDT pool<br><br>- called <u>getReward</u>() to claim rewards from VaultFlipToFlip. With the higher LP token valuation, the EOA is able to claim a reward of 6.97M BUNNY (valued at about $1+ B)<br><br>- returned the flash loans in point 1 back to PancakeSwap pools and Fortube Bank<br><br>The stolen funds were held at this address:</p><p>0xa0acc61547f6bd066f7c9663c17a312b6ad7e187</p>",2021-05-19,45000000,100000,[2],Yield Aggregator,Flash Loan Attack,{'name': 'BUNNY'}
2775,DEFI100,"<p>On May 22, a message materialized on the DEFI 100 website homepage reading: “WE SCAMMED YOU GUYS AND YOU CANT [sic] DO SHIT ABOUT IT HAHA…All you moon bois have been scammed and you cant do shit about it. FUCK YOU MOONBOIS.” The message was signed “DEVISIN” and has since been deleted.<br><br>On May 23, the DeFi100 Twitter account posted that their website had been hacked the previous day, and that the hacker had written the profane message:<br>https://twitter.com/DEFI100/status/1396361647149633537</p>",2021-05-23,32000000,0,[2],Stablecoin,Rugpull,{'name': 'D100'}
2790,Fireblocks,"<p><strong>Quick Summary</strong></p><p>Fireblocks company lost 75,000,000 $USD due to the negligence of the security engineer</p><p><br></p><p><strong>Details of the Exploit</strong></p><p>FireBlocks is an Israeli company that offers traditional financial institutes a seamless plug into the decentralized finance ecosystem and its customers. Cryptocurrency company StakeHound has filed a lawsuit against &nbsp;Fireblocks, claiming that it lost NIS 245.5 million (approximately $75 million) worth of cryptocurrencies it was entrusted with. StakeHound claims that Fireblocks, a developer of secure cross-enterprise asset transfer infrastructure, was negligent and as a result, the funds have been lost and can not be recovered. Fireblocks has denied any wrongdoing, claiming that: ""The keys were generated by the client and stored outside the Fireblocks platform,"" and that ""the customer did not store the backup with a third-party service provider per our guidelines.""</p>",2021-06-22,75000000,0,[],CeFi,Access Control,{'name': None}
2350,StableMagnet,"<p><strong>Quick Summary</strong></p><p>StableMagnet was rugpulled for over 27,000,000 $USD. The scammer used an unverified contract to transfer approved tokens.</p><p><br></p><p><strong>Details of the Exploit</strong></p><p>The exit scam started from this transaction:<br>https://bscscan.com/tx/0xf0ba46c8a20e1e75ad382e42c509bf71393e1b3b90326165c747a5d3cc5d967c<br><br>As a result, 8M USDT, 7.2M USDC, and 7M BUSD were taken from the StableMagnet 3Pool via an unverified source code.<br><br>The unverified SwapUtil library did not only contain code to drain all pairs, it also contained code to transfer more tokens to everyone who had approved StableMagnet.</p><p><br></p><p><strong>Block Data Reference</strong><br>SwapUtils library containing the exploit:<br>https://bscscan.com/address/0xE25d05777BB4bD0FD0Ca1297C434e612803eaA9a<br><br>The stolen funds were distributed between some external wallets. BUSD sent to Binance hot wallet:<br>https://bscscan.com/address/0x2bac04457e5de654cf1600b803e714c2c3fb96d7#tokentxns<br><br>Tether received on ETH chain:<br>https://etherscan.io/address/0xDF5B180c0734fC448BE30B7FF2c5bFc262bDEF26#tokentxns<br><br>Tether changed to DAI:<br>https://etherscan.io/address/0xe5daac909a3205f99d370bc2b32b1810a4912a07#tokentxns</p>",2021-06-23,27000000,24000000,[2],Other,Rugpull,{'name': 'SMAG'}
2734,Bilaxy,"<p>The attacker's address:<br>https://etherscan.io/address/0xa14d5da3c6bf2d9304fe6d4bc6942395b4de048b<br><br>The affected Bilaxy's hot wallet:<br>https://etherscan.io/address/0xcce8d59affdd93be338fc77fa0a298c2cb65da59<br><br>Bilaxy's hot wallet was compromised by the hacker and as a result, approximately 295 ERC20 tokens were transferred by the hacker to the address, including Tether (USDT), USD Coin (USDC), Uniswap (UNI), SushiSwap (SUSHI) amongst others.<br><br>300 ETH were deposited into Tornado Cash mixer:<br>https://bloxy.info/txs/calls_from/0xa14d5da3c6bf2d9304fe6d4bc6942395b4de048b?signature_id=994162&amp;smart_contract_address_bin=0x722122df12d4e14e13ac3b6895a86e84145b6967</p>",2021-08-29,21709378,0,[],CeFi,Other,{'name': 'BIA'}
2596,Cream Finance,"<p><strong>Quick Summary</strong></p><p>Cream Finance got exploited through a vulnerability hidden in the borrow() function, which was repeatedly utilized for reentrancy attacks. The attacker made away with approx. $36 million.</p><p><br></p><p><strong>Details of the Exploit</strong></p><p>Cream (Crypto Rules Everything Around Me) Finance is a decentralized lending protocol designed for institutions, protocols and people in order to access financial services.</p><p>The risk for reentrancy arose because of the way $AMP was integrated into the protocol. The $AMP token contract is based on the ERC777 standard, which utilizes the _callPostTransferHooks hook. The attack transactions started with supplying $ETH as a collateral for borrowing $AMP from the crAMP market. When transferring AMP to the attacking contract, the _callPostTransferHooks was called, which in turn triggered the execution of a fallback function in the attack contract allowing the latter to re-enter the crETH market to borrow $ETH against the very same collateral initially supposed to be used for borrowing $AMP.</p><p>The flow of an example exploit transaction: https://etherscan.io/tx/0xa9a1b8ea288eb9ad315088f17f7c7386b9989c95b4d13c81b69d5ddad7ffe61e</p><p>- The hacker creates contract A to flash loan 500 $WETH and use the funds as collateral on cream, minting 24.17k crETH;</p><p>- borrows 19.48M $AMP for the received crETH;</p><p>- exploits the reentrancy possibility by repeatedly calling borrow() during the token transfer, taking a further 355 $ETH before the state of the initial borrow() has been updated;</p><p>- uses contract B, which receives a half (9.74M) of A's borrowed $AMP;</p><p>- contract B liquidates part of A's loan, redeeming 187 $WETH and transferring it back to contract A;</p><p>- contract A uses $ETH borrowed via reentrancy to repay the remainder of the flash loan.</p><p><br></p><p>The profits of the above explained transaction amounted to 41 $ETH and 9.74M $AMP.</p><p>In total, 17 attack transactions were conducted netting the attackers a total of $AMP 462,079,976 and $ETH 2,804.96.</p><p><br></p><p><strong>Block Data Reference</strong></p><p>Attack contract A:</p><p>https://etherscan.io/address/0x38c40427efbaae566407e4cde2a91947df0bd22b</p><p>Attack contract B:</p><p>https://etherscan.io/address/0x0ec306D7634314D35139d1dF4A630d829475A125</p><p>Exploiter address 1:</p><p>https://etherscan.io/address/0xce1f4b4f17224ec6df16eeb1e3e5321c54ff6ede</p><p>Exploiter address 2:</p><p>https://etherscan.io/address/0x8036EbD0Fc9C120BA0469ffCB27b204AA06aaF1F</p><p><br></p>",2021-08-31,36154954,0,[1],Borrowing and Lending,Other,{'name': 'CREAM'}
2638,Vee Finance,<p>The attacker:<br>https://cchain.explorer.avax.network/address/0xeeeE458C3a5eaAfcFd68681D405FB55Ef80595BA/transactions<br><br>The contract behind the attack:<br>https://cchain.explorer.avax.network/address/0x490D25A327768bD5E3d2bF98B8E10419B3E70B82/transactions<br><br>The attacker deployed a smart contract with the malicious logic which interacted with one of the protocol smart contracts. Both contracts are unverified.<br><br>The list of transactions where the funds were withdrawn:<br>https://cchain.explorer.avax.network/address/0x490D25A327768bD5E3d2bF98B8E10419B3E70B82/token-transfers<br><br>WBTC and WETH were bridged to the Ethereum and are still held on the attacker's address here:<br>https://etherscan.io/address/0xeeee458c3a5eaafcfd68681d405fb55ef80595ba</p>,2021-09-21,36000000,0,[6],Borrowing and Lending,Other,{'name': 'VEE'}
2663,Compound Labs (2),"<p><strong>Quick Summary</strong></p><p>Compound's new proposal caused a loss of 237,000 $COMP tokens due to the smart contract issue</p><p><br><strong>Details of the Exploit</strong><br>Compound's governance Proposal 62 changed the distribution in the Comptroller contract to liquidity suppliers and borrowers from a previous 50:50 split to new governance proposed ratios:<br>https://compound.finance/governance/proposals/62<br><br>However, the Comptroller contract contains a bug, causing some users to receive too much COMP. The Comptroller received tokens for distribution from the Reservoir contract at:<br>https://etherscan.io/tx/0xe76167796646eb447cf53a72f1b912ad5028e64f8c8129b1a3fb71c1379f2322<br><br>84,000,000 in $COMP tokens are at risk<br><br>Approximately 237,000 $COMP tokens are already distributed between different addresses and can be calculated as a loss at the current moment.</p><p><br></p><p><strong>Block Data Reference</strong></p><p>The examples of transactions that trigger the bug:<br>https://etherscan.io/tx/0xc9244e5349f49f3b74a54a882e71f1ca11ba14ed74f73bf2cd091ed8be2b0001<br>https://etherscan.io/tx/0xbc246c878326f2c128462d08a0b74048b1dbee733adde8863f569c949c06422a<br>https://etherscan.io/tx/0xd77300cd5f10d835d60aa7560ab6a140887e6f84cc76b7911e83a46293492f94<br>https://etherscan.io/tx/0xc9244e5349f49f3b74a54a882e71f1ca11ba14ed74f73bf2cd091ed8be2b0001<br>https://etherscan.io/tx/0x0fefe4a123e9137e7725e07166ddd0e29e8e4a2e3f71d788c6edec6bf13b45c1<br>https://etherscan.io/tx/0xf3731f0e45a2a14fa93345453f10c793b29b707a92cb50d05a7ec5a4d280a973<br>https://etherscan.io/tx/0xb6d5122afe04a9905adc5de7f708cabc5821e65fb7d6f0bfd571d35b1ddab7f2<br>https://etherscan.io/tx/0xf4bfef1655f2092cf062c008153a5be66069b2b1fedcacbf4037c1f3cc8a9f45<br>https://etherscan.io/tx/0xee318650ae8bcf83517e77e8654d40201990080fcb888087f737aea28e70bdb1</p><p><br></p><p>Comptroller contract:<br>https://etherscan.io/address/0x3d9819210a31b4961b30ef54be2aed79b9c9cd3b<br><br>Reservoir contract:<br>https://etherscan.io/address/0x2775b1c75658be0f640272ccb8c72ac986009e38<br><br>List of addresses, which claimed a huge amount of tokens:<br>https://twitter.com/0xngmi/status/1443442885618278407</p><p><br></p>",2021-09-30,71101556,0,[1],Borrowing and Lending,Other,{'name': 'COMP'}
2686,AnubisDAO,"<p><strong>Quick Summary</strong></p><p>AnubisDAO was hacked, and 13,597 $ETH was drained before the sale round ends</p><p><br></p><p><strong>Details of the Exploit</strong></p><p>The project was holding fundraising using the Copper fair launch auction.<br>AnubisDAO named itself as a fork of OlympusDAO. All deposited $ETH was withdrawn from the Balancer Vault into the EOA wallet, before a couple of hours left for the sale round finish.</p><p><br></p><p><strong>Block Data Reference</strong><br>Stealing transaction:</p><p>https://etherscan.io/tx/0x551890a877c57cf19ddcb312c0a9962029225373daf2815f3720b723bd79b7b0<br>The further funds flow:<br>https://etherscan.io/tx/0x96756028f67fb4a5b49f0b7bc08e8c4173c388de1a7da9debb8f3033a1777fce<br>https://etherscan.io/tx/0x002724097966061607100ad99dcb991971b864ad6efa75e4f46145d6d1c904b4<br>Stolen funds are holding on this address:<br>https://etherscan.io/address/0xb1302743acf31f567e9020810523f5030942e211</p><p>Copper auction:</p><p><span style='color: rgb(65, 65, 65); font-family: ""Open Sans"", sans-serif; font-size: 14px; font-style: normal; font-variant-ligatures: normal; font-variant-caps: normal; font-weight: 400; letter-spacing: normal; orphans: 2; text-align: left; text-indent: 0px; text-transform: none; white-space: normal; widows: 2; word-spacing: 0px; -webkit-text-stroke-width: 0px; background-color: rgb(255, 255, 255); text-decoration-thickness: initial; text-decoration-style: initial; text-decoration-color: initial; display: inline !important; float: none;'>https://copperlaunch.com/auctions/0x9212b088d48fc749c5adc573b445bc0d0a289a34</span> </p>",2021-10-29,60000000,0,[1],Exchange (DEX),Rugpull,{'name': 'ANKH'}
2691,bZx (4),"<p>The private key, controlling BSC and Polygon deployments was compromised. The attackers started transferring ownership of the core bZx contracts starting from the transaction:<br>1. <u>setTerget</u>():<br>https://bscscan.com/tx/0x57e4aa5f2303a0ad4d1d74b1f33ba08a7ae2bf33cb1fa13870230779a3d52199<br><br>target address:<br>https://bscscan.com/address/0x8a610ab8be11ad555c358fd1dc26bb5d0bc82982<br><br>2. <u>transferOwnership</u>():<br>https://bscscan.com/tx/0x9b16f5e8a648f72be3f9657880b26e525018e40e8873a14161690f8f48bf01b9<br><br>3. <u>newOwner (</u>Exploiter 2<u>)</u>:<br>https://bscscan.com/address/0x0acc0e5faa09cb1976237c3a9af3d3d4b2f35fa5<br><br>4. Exploiter 2 invoking target contract from step 1 with 0x55 method through fallback function with delegatecall(gas, target, add(data, 0x20), mload(data), 0, 0) inside<br><br>5. Step 4 allowed Exploiter 2 to withdraw users' deposited collateral from interest iTokens into Exploiter 4 address, example transactions:<br>iDOGE =&gt; DOGE:<br>https://bscscan.com/tx/0xd1cff35db2583a2b3a239195c4567c8b63589079f8a1a9bdd0ef88a75b1ec18d<br><br>iETH =&gt; ETH:<br>https://bscscan.com/tx/0xa288f212bb84d0fa21274d93bc562ad4ecb4c702ff136ba897bbb65d0e50ca88<br><br>iBNB =&gt; BNB:<br>https://bscscan.com/tx/0x2dbb3df6959ba95da3bec8f618a3014f0d14e16816f2502e16d21e24e2597b6a<br><br>The same method was used on the Polygon chain.<br><br>List of involved addresses (BSC, Polygon, and Ethereum):<br><br>Exploiter 1:<br>0x74487eed1e67f4787e8c0570e8d5d168a05254d4<br>Exploiter 2:<br>0x0acc0e5faa09cb1976237c3a9af3d3d4b2f35fa5<br>Exploiter 3:<br>0x967bb571f0fc9ee79c892abf9f99233aa1737e31<br>Exploiter 4:<br>0x6551fb9be444987f7482012cbf7ea95a1ee8dd0e</p>",2021-11-05,47600000,0,"[2, 3]",Borrowing and Lending,Access Control,{'name': 'BZRX'}
